{
  "schema_version": 1,
  "id": "est.mean.two_sided_interval_99",
  "kind": "worked_calculation",
  "chapter_prefix": "est",
  "source_notebook": "notebooks/support/population-estimation/support.Rmd",
  "source_context": "Exercise 2.3 two-sided confidence interval (99%)",
  "source_dataset": "FSaudit::salaries",
  "target_snippet": "generated/worked-calculations/est-mean-two-sided-interval-99.tex",
  "tolerance": 0.00000001,
  "language_scope": "shared",
  "equation_labels": [
    "eq:two-sided"
  ],
  "values": [
    {
      "id": "est.mean.sample_size",
      "role": "sample_size",
      "raw": 50.00000000,
      "display": "50",
      "format": "integer",
      "tolerance": 0.00000001,
      "language_scope": "shared"
    },
    {
      "id": "est.mean.sample_sd",
      "role": "sample_sd",
      "raw": 1537.55140000,
      "display": "1,537.55",
      "format": "number:2",
      "tolerance": 0.00000001,
      "language_scope": "shared"
    },
    {
      "id": "est.mean.sample_mean",
      "role": "sample_mean",
      "raw": 3014.16000000,
      "display": "3,014.16",
      "format": "number:2",
      "tolerance": 0.00000001,
      "language_scope": "shared"
    },
    {
      "id": "est.mean.t_value_99",
      "role": "t_value_99",
      "raw": 2.68000000,
      "display": "2.680",
      "format": "number:3",
      "tolerance": 0.00000001,
      "language_scope": "shared"
    },
    {
      "id": "est.mean.precision_99",
      "role": "precision_99",
      "raw": 582.73570000,
      "display": "582.74",
      "format": "number:2",
      "tolerance": 0.00000001,
      "language_scope": "shared"
    },
    {
      "id": "est.mean.lower_99",
      "role": "lower_99",
      "raw": 2431.42430000,
      "display": "2,431.42",
      "format": "number:2",
      "tolerance": 0.00000001,
      "language_scope": "shared"
    },
    {
      "id": "est.mean.upper_99",
      "role": "upper_99",
      "raw": 3596.89570000,
      "display": "3,596.90",
      "format": "number:2",
      "tolerance": 0.00000001,
      "language_scope": "shared"
    },
    {
      "id": "est.mean.population_size",
      "role": "population_size",
      "raw": 2222.00000000,
      "display": "2,222",
      "format": "integer",
      "tolerance": 0.00000001,
      "language_scope": "shared"
    },
    {
      "id": "est.mean.total_lower_99",
      "role": "total_lower_99",
      "raw": 5402624.72670000,
      "display": "5,402,625",
      "format": "integer",
      "tolerance": 0.00000001,
      "language_scope": "shared"
    },
    {
      "id": "est.mean.total_upper_99",
      "role": "total_upper_99",
      "raw": 7992302.31330000,
      "display": "7,992,302",
      "format": "integer",
      "tolerance": 0.00000001,
      "language_scope": "shared"
    }
  ]
}
