{
  "schema_version": 1,
  "id": "est.mean.stein_interval",
  "kind": "worked_calculation",
  "chapter_prefix": "est",
  "source_notebook": "notebooks/support/population-estimation/support.Rmd",
  "source_context": "Exercise 2.4 Stein two-step confidence interval",
  "source_dataset": "FSaudit::salaries",
  "target_snippet": "generated/worked-calculations/est-mean-stein-interval.tex",
  "tolerance": 0.00000001,
  "language_scope": "shared",
  "equation_labels": [
    "eq:stein"
  ],
  "values": [
    {
      "id": "est.mean.population_size",
      "role": "population_size",
      "raw": 2222.00000000,
      "display": "2,222",
      "format": "integer",
      "tolerance": 0.00000001,
      "language_scope": "shared"
    },
    {
      "id": "est.mean.sample2_mean",
      "role": "sample2_mean",
      "raw": 3332.13740000,
      "display": "3,332.14",
      "format": "number:2",
      "tolerance": 0.00000001,
      "language_scope": "shared"
    },
    {
      "id": "est.mean.t_value_95",
      "role": "t_value_95",
      "raw": 2.00960000,
      "display": "2.010",
      "format": "number:3",
      "tolerance": 0.00000001,
      "language_scope": "shared"
    },
    {
      "id": "est.mean.sample_sd",
      "role": "sample_sd",
      "raw": 1537.55140000,
      "display": "1,537.55",
      "format": "number:2",
      "tolerance": 0.00000001,
      "language_scope": "shared"
    },
    {
      "id": "est.mean.n_total",
      "role": "n_total",
      "raw": 131.00000000,
      "display": "131",
      "format": "integer",
      "tolerance": 0.00000001,
      "language_scope": "shared"
    },
    {
      "id": "est.mean.stein_total_point",
      "role": "stein_total_point",
      "raw": 7404009.31300000,
      "display": "7,404,009",
      "format": "integer",
      "tolerance": 0.00000001,
      "language_scope": "shared"
    },
    {
      "id": "est.mean.stein_precision",
      "role": "stein_precision",
      "raw": 599849.52040000,
      "display": "599,850",
      "format": "integer",
      "tolerance": 0.00000001,
      "language_scope": "shared"
    },
    {
      "id": "est.mean.target_precision_600k",
      "role": "target_precision_600k",
      "raw": 600000.00000000,
      "display": "600,000",
      "format": "integer",
      "tolerance": 0.00000001,
      "language_scope": "shared"
    }
  ]
}
