{
  "schema_version": 1,
  "id": "est.mean.minimum_sample_size_finite",
  "kind": "worked_calculation",
  "chapter_prefix": "est",
  "source_notebook": "notebooks/support/population-estimation/support.Rmd",
  "source_context": "Exercise 2.5 minimum sample size for mean with finite-population correction",
  "source_dataset": "FSaudit::salaries",
  "target_snippet": "generated/worked-calculations/est-mean-minimum-sample-size-finite.tex",
  "tolerance": 0.00000001,
  "language_scope": "shared",
  "equation_labels": [
    
  ],
  "values": [
    {
      "id": "est.mean.population_size",
      "role": "population_size",
      "raw": 2222.00000000,
      "display": "2,222",
      "format": "integer",
      "tolerance": 0.00000001,
      "language_scope": "shared"
    },
    {
      "id": "est.mean.t_value_95",
      "role": "t_value_95",
      "raw": 2.00960000,
      "display": "2.010",
      "format": "number:3",
      "tolerance": 0.00000001,
      "language_scope": "shared"
    },
    {
      "id": "est.mean.sample_variance",
      "role": "sample_variance",
      "raw": 2364064.25960000,
      "display": "2,364,064",
      "format": "integer",
      "tolerance": 0.00000001,
      "language_scope": "shared"
    },
    {
      "id": "est.mean.target_precision_300k",
      "role": "target_precision_300k",
      "raw": 300000.00000000,
      "display": "300,000",
      "format": "integer",
      "tolerance": 0.00000001,
      "language_scope": "shared"
    },
    {
      "id": "est.mean.gamma_finite",
      "role": "gamma_finite",
      "raw": 4.24260000,
      "display": "4.243",
      "format": "number:3",
      "tolerance": 0.00000001,
      "language_scope": "shared"
    },
    {
      "id": "est.mean.min_n_finite",
      "role": "min_n_finite",
      "raw": 423.83660000,
      "display": "423.8",
      "format": "number:1",
      "tolerance": 0.00000001,
      "language_scope": "shared"
    },
    {
      "id": "est.mean.min_n_finite_ceiling",
      "role": "min_n_finite_ceiling",
      "raw": 424.00000000,
      "display": "424",
      "format": "integer",
      "tolerance": 0.00000001,
      "language_scope": "shared"
    },
    {
      "id": "est.mean.min_n_infinite_300k",
      "role": "min_n_infinite_300k",
      "raw": 523.73720000,
      "display": "524",
      "format": "integer",
      "tolerance": 0.00000001,
      "language_scope": "shared"
    }
  ]
}
