{
  "schema_version": 1,
  "id": "aux.difference.estimator",
  "kind": "worked_calculation",
  "chapter_prefix": "aux",
  "source_notebook": "notebooks/support/auxiliary-variables-and-stratification/support.Rmd",
  "source_context": "Exercise 3.5 and corresponding manuscript worked derivation",
  "source_dataset": "FSaudit::inventoryData",
  "target_snippet": "generated/worked-calculations/aux-difference-estimator.tex",
  "tolerance": 0.00000001,
  "language_scope": "r",
  "equation_labels": [
    "eq:difference_estimate", "eq:sd_diff", "eq:prediction_interval_MPU_with_g"
  ],
  "values": [
    {
      "id": "aux.diff.population_size",
      "role": "population_size",
      "raw": 3500.00000000,
      "display": "3,500",
      "format": "integer",
      "tolerance": 0.00000001,
      "language_scope": "r"
    },
    {
      "id": "aux.diff.sample_size",
      "role": "sample_size",
      "raw": 400.00000000,
      "display": "400",
      "format": "integer",
      "tolerance": 0.00000001,
      "language_scope": "r"
    },
    {
      "id": "aux.diff.population_book_total",
      "role": "population_book_total",
      "raw": 7360816.00000000,
      "display": "7,360,816",
      "format": "integer",
      "tolerance": 0.00000001,
      "language_scope": "r"
    },
    {
      "id": "aux.diff.sum_difference",
      "role": "sum_difference",
      "raw": -1011.11000000,
      "display": "-1,011.11",
      "format": "number:2",
      "tolerance": 0.00000001,
      "language_scope": "r"
    },
    {
      "id": "aux.diff.sum_squared_difference",
      "role": "sum_squared_difference",
      "raw": 135190037.643300,
      "display": "135,190,038",
      "format": "integer",
      "tolerance": 0.000001,
      "language_scope": "r"
    },
    {
      "id": "aux.diff.estimated_population_value",
      "role": "estimated_population_value",
      "raw": 7369663.21250000,
      "display": "7,369,663",
      "format": "integer",
      "tolerance": 0.00000001,
      "language_scope": "r"
    },
    {
      "id": "aux.diff.difference_variance",
      "role": "difference_variance",
      "raw": 338815.74380000,
      "display": "338,815.74",
      "format": "number:2",
      "tolerance": 0.00000001,
      "language_scope": "r"
    },
    {
      "id": "aux.diff.g_factor",
      "role": "g_factor",
      "raw": 164.69670000,
      "display": "164.6967",
      "format": "number:4",
      "tolerance": 0.00000001,
      "language_scope": "r"
    },
    {
      "id": "aux.diff.t_value",
      "role": "t_value",
      "raw": 1.96590000,
      "display": "1.966",
      "format": "number:3",
      "tolerance": 0.00000001,
      "language_scope": "r"
    },
    {
      "id": "aux.diff.precision",
      "role": "precision",
      "raw": 188466.47920000,
      "display": "188,466",
      "format": "integer",
      "tolerance": 0.00000001,
      "language_scope": "r"
    },
    {
      "id": "aux.diff.interval_lower",
      "role": "interval_lower",
      "raw": 7181196.73330000,
      "display": "7,181,197",
      "format": "integer",
      "tolerance": 0.00000001,
      "language_scope": "r"
    },
    {
      "id": "aux.diff.interval_upper",
      "role": "interval_upper",
      "raw": 7558129.69170000,
      "display": "7,558,130",
      "format": "integer",
      "tolerance": 0.00000001,
      "language_scope": "r"
    }
  ]
}
