{
  "schema_version": 1,
  "id": "est.mean.point_estimate",
  "kind": "worked_calculation",
  "chapter_prefix": "est",
  "source_notebook": "notebooks/support/population-estimation/support.Rmd",
  "source_context": "Exercise 2.2 point estimate of the mean",
  "source_dataset": "FSaudit::salaries",
  "target_snippet": "generated/worked-calculations/est-mean-point-estimate.tex",
  "tolerance": 0.00000001,
  "language_scope": "r",
  "equation_labels": [
    "eq:sample_mean"
  ],
  "values": [
    {
      "id": "est.mean.sample_total_gross",
      "role": "sample_total_gross",
      "raw": 150708.00000000,
      "display": "150,708",
      "format": "integer",
      "tolerance": 0.00000001,
      "language_scope": "r"
    },
    {
      "id": "est.mean.sample_size",
      "role": "sample_size",
      "raw": 50.00000000,
      "display": "50",
      "format": "integer",
      "tolerance": 0.00000001,
      "language_scope": "r"
    },
    {
      "id": "est.mean.sample_mean",
      "role": "sample_mean",
      "raw": 3014.16000000,
      "display": "3,014.16",
      "format": "number:2",
      "tolerance": 0.00000001,
      "language_scope": "r"
    }
  ]
}
