{
  "schema_version": 1,
  "id": "reg.annual.decision_bounds",
  "kind": "worked_calculation",
  "chapter_prefix": "reg",
  "source_notebook": "notebooks/support/regression-analysis/support.Rmd",
  "source_context": "Exercise 5.36 decision bounds and acceptable difference range",
  "source_dataset": "USSteamCo hold-out predictions",
  "target_snippet": "generated/worked-calculations/reg-annual-decision-bounds.tex",
  "tolerance": 0.00000001,
  "language_scope": "r",
  "equation_labels": [
    "eq:acceptable_difference_range"
  ],
  "values": [
    {
      "id": "reg.annual.annual_se",
      "role": "annual_se",
      "raw": 6323301.06740000,
      "display": "6,323,301",
      "format": "integer",
      "tolerance": 0.00000001,
      "language_scope": "r"
    },
    {
      "id": "reg.annual.adr_lower",
      "role": "adr_lower",
      "raw": -17389050.45160000,
      "display": "-17,389,050",
      "format": "integer",
      "tolerance": 0.00000001,
      "language_scope": "r"
    },
    {
      "id": "reg.annual.adr_upper",
      "role": "adr_upper",
      "raw": 17389050.45160000,
      "display": "17,389,050",
      "format": "integer",
      "tolerance": 0.00000001,
      "language_scope": "r"
    },
    {
      "id": "reg.annual.c_lower",
      "role": "c_lower",
      "raw": -2.75000000,
      "display": "-2.75",
      "format": "number:2",
      "tolerance": 0.00000001,
      "language_scope": "r"
    },
    {
      "id": "reg.annual.c_upper",
      "role": "c_upper",
      "raw": 2.75000000,
      "display": "2.75",
      "format": "number:2",
      "tolerance": 0.00000001,
      "language_scope": "r"
    }
  ]
}
