{
  "schema_version": 1,
  "id": "est.total.point_estimate",
  "kind": "worked_calculation",
  "chapter_prefix": "est",
  "source_notebook": "notebooks/support/population-estimation/support.Rmd",
  "source_context": "Exercise 2.2 point estimate of the total payroll",
  "source_dataset": "FSaudit::salaries",
  "target_snippet": "generated/worked-calculations/est-total-point-estimate.tex",
  "tolerance": 0.00000001,
  "language_scope": "r",
  "equation_labels": [
    "eq:estimate_total"
  ],
  "values": [
    {
      "id": "est.total.population_size",
      "role": "population_size",
      "raw": 2222.00000000,
      "display": "2,222",
      "format": "integer",
      "tolerance": 0.00000001,
      "language_scope": "r"
    },
    {
      "id": "est.total.sample_total_gross",
      "role": "sample_total_gross",
      "raw": 150708.00000000,
      "display": "150,708",
      "format": "integer",
      "tolerance": 0.00000001,
      "language_scope": "r"
    },
    {
      "id": "est.total.sample_size",
      "role": "sample_size",
      "raw": 50.00000000,
      "display": "50",
      "format": "integer",
      "tolerance": 0.00000001,
      "language_scope": "r"
    },
    {
      "id": "est.total.estimated_total_gross",
      "role": "estimated_total_gross",
      "raw": 6697463.52000000,
      "display": "6,697,464",
      "format": "integer",
      "tolerance": 0.00000001,
      "language_scope": "r"
    }
  ]
}
