{
  "schema_version": 1,
  "id": "est.mean.two_sided_finite_95",
  "kind": "worked_calculation",
  "chapter_prefix": "est",
  "source_notebook": "notebooks/support/population-estimation/support.Rmd",
  "source_context": "Exercise 2.5 finite-population corrected two-sided confidence interval (95%)",
  "source_dataset": "FSaudit::salaries",
  "target_snippet": "generated/worked-calculations/est-mean-two-sided-finite-95.tex",
  "tolerance": 0.00000001,
  "language_scope": "r",
  "equation_labels": [
    "eq:two-sided_finite"
  ],
  "values": [
    {
      "id": "est.mean.sample_size",
      "role": "sample_size",
      "raw": 50.00000000,
      "display": "50",
      "format": "integer",
      "tolerance": 0.00000001,
      "language_scope": "r"
    },
    {
      "id": "est.mean.population_size",
      "role": "population_size",
      "raw": 2222.00000000,
      "display": "2,222",
      "format": "integer",
      "tolerance": 0.00000001,
      "language_scope": "r"
    },
    {
      "id": "est.mean.sample_sd",
      "role": "sample_sd",
      "raw": 1537.55140000,
      "display": "1,537.55",
      "format": "number:2",
      "tolerance": 0.00000001,
      "language_scope": "r"
    },
    {
      "id": "est.mean.sample_mean",
      "role": "sample_mean",
      "raw": 3014.16000000,
      "display": "3,014.16",
      "format": "number:2",
      "tolerance": 0.00000001,
      "language_scope": "r"
    },
    {
      "id": "est.mean.t_value_95",
      "role": "t_value_95",
      "raw": 2.00960000,
      "display": "2.010",
      "format": "number:3",
      "tolerance": 0.00000001,
      "language_scope": "r"
    },
    {
      "id": "est.mean.precision_finite_95",
      "role": "precision_finite_95",
      "raw": 432.12020000,
      "display": "432.12",
      "format": "number:2",
      "tolerance": 0.00000001,
      "language_scope": "r"
    },
    {
      "id": "est.mean.precision_95",
      "role": "precision_95",
      "raw": 436.96730000,
      "display": "436.97",
      "format": "number:2",
      "tolerance": 0.00000001,
      "language_scope": "r"
    },
    {
      "id": "est.mean.fpc_factor",
      "role": "fpc_factor",
      "raw": 0.98890000,
      "display": "0.989",
      "format": "number:3",
      "tolerance": 0.00000001,
      "language_scope": "r"
    }
  ]
}
