{
  "schema_version": 1,
  "id": "est.prop.binomial_interval_95",
  "kind": "worked_calculation",
  "chapter_prefix": "est",
  "source_notebook": "notebooks/support/population-estimation/support.Rmd",
  "source_context": "Exercise 2.6 binomial confidence interval for proportion (95%)",
  "source_dataset": "FSaudit::salaries",
  "target_snippet": "generated/worked-calculations/est-prop-binomial-interval-95.tex",
  "tolerance": 0.00000001,
  "language_scope": "r",
  "equation_labels": [
    "eq:lower_bound_binomial", "eq:upper_bound_binomial"
  ],
  "values": [
    {
      "id": "est.prop.k",
      "role": "k",
      "raw": 31.00000000,
      "display": "31",
      "format": "integer",
      "tolerance": 0.00000001,
      "language_scope": "r"
    },
    {
      "id": "est.prop.n",
      "role": "n",
      "raw": 50.00000000,
      "display": "50",
      "format": "integer",
      "tolerance": 0.00000001,
      "language_scope": "r"
    },
    {
      "id": "est.prop.f_value_lower",
      "role": "f_value_lower",
      "raw": 1.73560000,
      "display": "1.736",
      "format": "number:3",
      "tolerance": 0.00000001,
      "language_scope": "r"
    },
    {
      "id": "est.prop.f_value_upper",
      "role": "f_value_upper",
      "raw": 1.81500000,
      "display": "1.815",
      "format": "number:3",
      "tolerance": 0.00000001,
      "language_scope": "r"
    },
    {
      "id": "est.prop.p_lower",
      "role": "p_lower",
      "raw": 0.47170000,
      "display": "0.472",
      "format": "number:3",
      "tolerance": 0.00000001,
      "language_scope": "r"
    },
    {
      "id": "est.prop.p_upper",
      "role": "p_upper",
      "raw": 0.75350000,
      "display": "0.753",
      "format": "number:3",
      "tolerance": 0.00000001,
      "language_scope": "r"
    }
  ]
}
